{
  "schemaVersion": 1,
  "asOf": "2026-09-14",
  "completeness": "complete",
  "phaseExit": "passed",
  "routeRoot": "src/app/api/producer",
  "routeGroups": [
    {
      "groupId": "editing-orchestration",
      "routes": [
        "src/app/api/producer/ai-edit/route.ts",
        "src/app/api/producer/auto-edit/route.ts"
      ],
      "role": "Command-driven incremental edits and full automatic editing.",
      "modePolicy": "mode-aware",
      "short": {
        "status": "compatibility",
        "behavior": "Uses short pacing, vertical-safe layouts, burned-caption defaults, and the shared isolated-candidate QC path.",
        "blockers": [
          "Short graphics repairs outside caption shards still cross the monolithic compatibility compositor.",
          "The bounded P2 structured repair lifecycle is released, but free-form creator-footage repair, general populated-layer picture repair, and connected Palmier readback remain unqualified."
        ]
      },
      "longform": {
        "status": "compatibility",
        "behavior": "Uses long-form planning, front-loaded pacing, chapters/SRT policy, and retained graphics/audio fast paths before isolated-candidate QC.",
        "blockers": [
          "The retained fast paths are not a qualified 10-14 minute incremental render graph or 90-minute SLA.",
          "The bounded P2 structured repair lifecycle is released, but free-form creator-footage repair, general populated-layer picture repair, and connected Palmier readback remain unqualified."
        ]
      },
      "incrementalBoundary": "Plan-only requests are surgical; caption shards and governed scene units can be local. Other changed plan lanes may rebuild the compatibility base or whole composite.",
      "palmierBoundary": "Auto Edit defaults to the Palmier-hybrid compatibility workflow; ai-edit may select a managed Palmier path. Native fidelity and full hybrid export remain separately gated."
    },
    {
      "groupId": "render-and-assemble",
      "routes": [
        "src/app/api/producer/assemble/route.ts",
        "src/app/api/producer/render/route.ts"
      ],
      "role": "Create an editor-ready base and assemble the approved final MP4.",
      "modePolicy": "mode-aware",
      "short": {
        "status": "compatibility",
        "behavior": "Renders short-safe captions/layout and reuses the base only when compatibility fingerprints permit.",
        "blockers": [
          "Graphics-only short repairs can still re-enter a monolithic graphics composite."
        ]
      },
      "longform": {
        "status": "compatibility",
        "behavior": "Supports retained graphics-only and audio-only paths over the editor-ready base.",
        "blockers": [
          "Whole-cut video fingerprints and incomplete cross-lane dependencies prevent a fully qualified dirty graph."
        ]
      },
      "incrementalBoundary": "Caption shards and selected graphics/audio lanes reuse stable media; cut, zoom, reframe, or stale dependencies rebuild the base.",
      "palmierBoundary": "These routes author the exact MP4 authority. Palmier publication is a separate delivery action."
    },
    {
      "groupId": "plan-authority",
      "routes": [
        "src/app/api/producer/intent/route.ts",
        "src/app/api/producer/lint/route.ts",
        "src/app/api/producer/plan/route.ts",
        "src/app/api/producer/save-plan/route.ts"
      ],
      "role": "Persist operator intent, validate plans, and expose the current plan.",
      "modePolicy": "mode-aware",
      "short": {
        "status": "released",
        "behavior": "Accepts canonical story form short independently from canvas and validates short-specific plan rules.",
        "blockers": []
      },
      "longform": {
        "status": "released",
        "behavior": "Accepts canonical story form longform independently from canvas and validates long-form-specific plan rules.",
        "blockers": []
      },
      "incrementalBoundary": "These routes mutate or validate JSON authority only; they do not render media.",
      "palmierBoundary": "Plan authority does not itself claim a Palmier timeline mutation."
    },
    {
      "groupId": "media-inspection",
      "routes": [
        "src/app/api/producer/comp-html/route.ts",
        "src/app/api/producer/comps/route.ts",
        "src/app/api/producer/filmstrip/route.ts",
        "src/app/api/producer/reveal/route.ts",
        "src/app/api/producer/source-frame/route.ts",
        "src/app/api/producer/transcript/route.ts",
        "src/app/api/producer/waveform/route.ts",
        "src/app/api/producer/words/route.ts"
      ],
      "role": "Read-only composition, frame, transcript, and waveform inspection.",
      "modePolicy": "form-neutral",
      "short": {
        "status": "released",
        "behavior": "Reads the selected project's exact source/derived evidence without choosing short policy.",
        "blockers": []
      },
      "longform": {
        "status": "released",
        "behavior": "Reads the selected project's exact source/derived evidence without choosing long-form policy.",
        "blockers": []
      },
      "incrementalBoundary": "Read-only inspection does not invalidate or render timeline nodes.",
      "palmierBoundary": "No Palmier mutation is authorized."
    },
    {
      "groupId": "media-ingress",
      "routes": [
        "src/app/api/producer/ingest/route.ts",
        "src/app/api/producer/pick-file/route.ts",
        "src/app/api/producer/supporting-media/route.ts",
        "src/app/api/producer/transcript-authority/route.ts"
      ],
      "role": "Select, snapshot, admit, and inventory source and supporting image/video media, including guarded exact-media transcript-authority promotion.",
      "modePolicy": "form-neutral",
      "short": {
        "status": "released",
        "behavior": "Admits immutable source media before short-form planning and can promote a timing-valid transcript only from an exact-media donor.",
        "blockers": []
      },
      "longform": {
        "status": "released",
        "behavior": "Admits immutable source media before long-form planning and can promote a timing-valid transcript only from an exact-media donor.",
        "blockers": []
      },
      "incrementalBoundary": "A source-set change invalidates dependent compilation/render authority in either form.",
      "palmierBoundary": "Ingress does not select Palmier as timeline authority."
    },
    {
      "groupId": "project-registry",
      "routes": [
        "src/app/api/producer/project-status/route.ts",
        "src/app/api/producer/projects/route.ts"
      ],
      "role": "List projects and report durable producer status.",
      "modePolicy": "form-neutral",
      "short": {
        "status": "released",
        "behavior": "Reports the stored short project state without changing it.",
        "blockers": []
      },
      "longform": {
        "status": "released",
        "behavior": "Reports the stored long-form project state without changing it.",
        "blockers": []
      },
      "incrementalBoundary": "Status reads do not invalidate media.",
      "palmierBoundary": "Palmier status is reported only from its explicit state records."
    },
    {
      "groupId": "reference-study",
      "routes": [
        "src/app/api/producer/references/decision/route.ts",
        "src/app/api/producer/references/fetch/route.ts",
        "src/app/api/producer/references/route.ts",
        "src/app/api/producer/references/study/route.ts"
      ],
      "role": "Admit a reference, study its mechanics, and retain operator strategy.",
      "modePolicy": "mode-aware",
      "short": {
        "status": "compatibility",
        "behavior": "Can study a short reference and feed the current planning prompts.",
        "blockers": [
          "Verified mimic on unseen footage is not P6-qualified."
        ]
      },
      "longform": {
        "status": "compatibility",
        "behavior": "Can study a long-form reference and feed the current planning prompts.",
        "blockers": [
          "Verified mimic on unseen footage is not P6-qualified."
        ]
      },
      "incrementalBoundary": "A changed reference profile invalidates planning/scene dependencies, not unrelated admitted source bytes.",
      "palmierBoundary": "Reference study supplies intent; it does not itself mutate Palmier."
    },
    {
      "groupId": "palmier-delivery",
      "routes": [
        "src/app/api/producer/live-build/route.ts",
        "src/app/api/producer/palmier/candidate-qc/route.ts",
        "src/app/api/producer/palmier/open/route.ts",
        "src/app/api/producer/palmier/ownership/route.ts",
        "src/app/api/producer/palmier/preflight/route.ts",
        "src/app/api/producer/palmier/push/route.ts",
        "src/app/api/producer/palmier/status/route.ts",
        "src/app/api/producer/palmier/view/route.ts",
        "src/app/api/producer/palmier/workspace/route.ts"
      ],
      "role": "Open, inspect, build, QC, push, and reconcile Palmier delivery state.",
      "modePolicy": "delivery-only",
      "short": {
        "status": "compatibility",
        "behavior": "Supports a local production-callable mastered-stereo route, exact hidden-master path, strict editable-parity contract, one-scene replacement executor, durable mutation journal, and immutable pre-mutation crash snapshots.",
        "blockers": [
          "Connected representative short export/readback, passing mastered-stereo audio-route authority, exact-master mutation, disconnect recovery, and manual-edit preservation are not qualified; editable stems lack stable role/output-bus readback."
        ]
      },
      "longform": {
        "status": "compatibility",
        "behavior": "Supports the same local mastered-stereo and delivery prerequisites for long-form candidates, including exact full-stream parity and fail-closed reconciliation.",
        "blockers": [